{
  "$schema": "https://json-schema.org/draft/2020-12/schema",
  "$id": "https://qianxing.local/schemas/strategy-api-input-v1.json",
  "title": "Qianxing Strategy API v1 — Input",
  "description": "运行时交给策略进程的只读 input 载荷（`StrategyContractInput` / `StrategyContractBars`）。与 `strategy_api_v1.schema.json` 合起来构成策略契约的双向机器可读定义。required 逐项等于 Rust 侧**实际必填**的字段：`bars`、`market_bars`、`positions_exact` 带 `#[serde(default)]`，`available_margin_raw` 是 `Option<i128>`，所以这些格可缺省。定点 raw 金额/数量按 Rust i128 交换，只允许 JSON 整数；`positions_exact` 是支持 18 位小数的有符号十进制字符串，与 positions 的 raw 兼容投影并存。多账户仓位可用 `account_id|InstrumentId` 键读取；运行时只提供已配置 Execution worker 且账户 EventLog 已存在的仓位。`market_bars` 按完整 InstrumentId 提供其他市场已校验、时间不晚于 as_of 的 Bar。",
  "type": "object",
  "required": [
    "schema_version",
    "request_id",
    "strategy_id",
    "strategy_version",
    "data_fingerprint",
    "as_of",
    "instrument",
    "positions",
    "cash",
    "risk_state",
    "research_targets"
  ],
  "properties": {
    "schema_version": {"const": 1},
    "request_id": {"type": "string", "minLength": 1},
    "strategy_id": {"type": "string", "minLength": 1},
    "strategy_version": {"type": "string", "minLength": 1},
    "data_fingerprint": {"type": "string", "minLength": 1},
    "as_of": {"type": "integer", "minimum": 1},
    "instrument": {"type": "string", "minLength": 1},
    "positions": {"$ref": "#/$defs/raw_ledger"},
    "positions_exact": {"$ref": "#/$defs/exact_signed_ledger"},
    "cash": {"$ref": "#/$defs/raw_ledger"},
    "available_margin_raw": {"$ref": "#/$defs/optional_raw_non_negative"},
    "risk_state": {"type": "string", "minLength": 1},
    "research_targets": {"$ref": "#/$defs/raw_ledger"},
    "bars": {
      "oneOf": [{"type": "null"}, {"$ref": "#/$defs/bars"}]
    },
    "market_bars": {
      "description": "主 bars 之外的市场历史，键为完整 InstrumentId；所有 Bar 都不得晚于 as_of。",
      "type": "object",
      "additionalProperties": {"$ref": "#/$defs/bars"}
    }
  },
  "additionalProperties": false,
  "$defs": {
    "raw_signed": {
      "description": "核心定点 raw 值（Rust i128，可负）：只允许 JSON 整数。持仓可为空头、现金在保证金账户可为负，所以这里不能收窄成非负。",
      "type": "integer"
    },
    "raw_non_negative": {
      "description": "必须非负的定点 raw 值（Rust 侧 `available_margin_raw` 的 validate 同样拒绝负数）。",
      "type": "integer",
      "minimum": 0
    },
    "optional_raw_non_negative": {
      "description": "可缺省的可用保证金：null 表示运行时未计算这一格，而不是算出来是零（与产物里 Option<i128> 的诚实语义一致）。",
      "oneOf": [{"type": "null"}, {"$ref": "#/$defs/raw_non_negative"}]
    },
    "raw_ledger": {
      "description": "以 InstrumentId 为键，或以 `account_id|InstrumentId` 为键（多账户持仓）的定点 raw 值账。键不在 schema 里做词法约束：那是运行时 validate 的职责，schema 只钉形态。",
      "type": "object",
      "additionalProperties": {"$ref": "#/$defs/raw_signed"}
    },
    "exact_signed_ledger": {
      "description": "精确的有符号十进制持仓数量，以 InstrumentId 或 `account_id|InstrumentId` 为键；十进制字符串最多 18 位小数。",
      "type": "object",
      "additionalProperties": {
        "type": "string",
        "pattern": "^-?(?:[0-9]+(?:\\.[0-9]*)?|\\.[0-9]+)(?:[eE][+-]?[0-9]+)?$"
      }
    },
    "bars": {
      "type": "object",
      "required": [
        "source",
        "ts",
        "open_raw",
        "high_raw",
        "low_raw",
        "close_raw",
        "volume_raw"
      ],
      "properties": {
        "source": {"type": "string", "minLength": 1},
        "ts": {
          "description": "严格递增的毫秒时间戳（Rust 侧 `StrategyContractBars::validate` 同样拒绝重复与倒序）。",
          "type": "array",
          "items": {"type": "integer", "minimum": 0}
        },
        "open_raw": {"$ref": "#/$defs/raw_series"},
        "high_raw": {"$ref": "#/$defs/raw_series"},
        "low_raw": {"$ref": "#/$defs/raw_series"},
        "close_raw": {"$ref": "#/$defs/raw_series"},
        "volume_raw": {"$ref": "#/$defs/raw_series"}
      },
      "additionalProperties": false
    },
    "raw_series": {
      "description": "一列定点 raw 值；Rust 侧只校验五列等长，不校验正负，故这里保持 raw_signed。",
      "type": "array",
      "items": {"$ref": "#/$defs/raw_signed"}
    }
  }
}
